{
  "$schema": "http://json-schema.org/draft-07/schema#",
  "type": "object",
  "properties": {
    "$schema": {
      "type": "string"
    },
    "Nothing matches that.": {
      "type": "string"
    },
    "Search": {
      "type": "string"
    },
    "Search the documentation": {
      "type": "string"
    },
    "Type to search the pages in this language.": {
      "type": "string"
    }
  },
  "required": [
    "Nothing matches that.",
    "Search",
    "Search the documentation",
    "Type to search the pages in this language."
  ],
  "additionalProperties": false
}
